{
  "$schema": "http://json-schema.org/draft-07/schema#",
  "$id": "https://telenor/agentic-sdlc-pilot/provenance.schema.json",
  "title": "Agent provenance",
  "description": "Provenance record an agent must write to .agent/provenance.json before its final commit (US-029/US-030).",
  "type": "object",
  "additionalProperties": true,
  "required": [
    "run_id",
    "task",
    "agent_identity",
    "human_approver",
    "model",
    "started_at",
    "finished_at",
    "prompt_hash",
    "tool_trace",
    "attachment_hashes",
    "token_cost"
  ],
  "properties": {
    "run_id": { "type": "string", "description": "Unique id for this agent run." },
    "task": { "type": "string", "description": "What the run was asked to do." },
    "agent_identity": { "type": "string", "description": "Agent identity (distinct from any human)." },
    "human_approver": { "type": "string", "description": "Human who approved the plan/PR (Checkpoint 1)." },
    "model": { "type": "string", "description": "Model id used, e.g. claude-opus-4-8." },
    "started_at": { "type": "string", "format": "date-time" },
    "finished_at": { "type": "string", "format": "date-time" },
    "prompt_hash": { "type": "string", "description": "Hash of the system prompt used." },
    "tool_trace": { "type": "array", "items": { "type": "string" }, "description": "Ordered tool invocations." },
    "attachment_hashes": { "type": "array", "items": { "type": "string" }, "description": "SHA-256 of any ingested attachments." },
    "token_cost": {
      "type": "object",
      "required": ["input", "output"],
      "properties": {
        "input": { "type": "number" },
        "output": { "type": "number" }
      }
    },
    "scope_anchor": {
      "type": ["string", "null"],
      "description": "Reference to the CP1-approved plan hash for this work. Optional during grace period ending 2026-08-02 per US-071; will become required in follow-up story that depends on US-066 (CP3 gate).",
      "$comment": "US-071 Phase 1 (this PR): field added optional. US-071 Phase 2 (follow-up, blocked on US-066): field becomes required + CP3 gate enforces comparison."
    },
    "cp1_approver": {
      "type": ["object", "null"],
      "description": "CP1 (plan approval) approver — US-066. Validated against the initiative's Change Lead in docs/team-routing.yaml when gate enforcement is enabled (US-066 Phase 2). Optional during Phase 0/1 (solo-operated).",
      "properties": {
        "identity": { "type": "string", "description": "Approver handle or name." },
        "approved_at": { "type": "string", "format": "date-time" },
        "plan_hash": { "type": "string", "description": "Hash of the CP1-approved plan." }
      }
    },
    "cp3_approver": {
      "type": ["object", "null"],
      "description": "CP3 (deployment closure) approver — US-066. Change Lead performs final closure; validated against team-routing.yaml under Phase 2 enforcement. Optional during Phase 0/1.",
      "properties": {
        "identity": { "type": "string", "description": "Approver handle or name." },
        "approved_at": { "type": "string", "format": "date-time" }
      }
    },
    "initiative": {
      "type": "string",
      "description": "The initiative that owns this work (key in docs/team-routing.yaml). Determines which Change Lead the CP1/CP3 approver is validated against (US-066 Phase 2). Defaults to 'agentic-pilot' (solo-operated, Phase 0/1) when absent."
    }
  }
}
